{
    "$schema": "http://json-schema.org/draft-07/schema",
    "$comment": "WSM Form Format",
    "title": "Form",
    "properties": {
        "id": {
            "type": "string",
            "description": "Identifier, should be the filename without `.json`"
        },
        "name": {
            "type": "string",
            "description": "Display Name"
        },
        "description": {
            "type": "string",
            "description": "Short description displayed on the form page"
        },
        "items": {
            "type": "array",
            "minItems": 1,
            "items": {
                "type": "object",
                "properties": {
                    "type": {
                        "enum": ["text", "number"]
                    },
                    "label": {
                        "type": "string"
                    }
                }
            }
        }
    },
    "required": [ "id", "name", "items"]
}